{
  "user_intent": "Transfer 100 USDC to 0x2222222222222222222222222222222222222222",
  "chainId": 1672,
  "from": "0x146b605c8b371d5b50c3ea560fd1a2081aee7557",
  "to": "0xc879c018db60520f4355c26ed1a6d572cdac1815",
  "value": "0x0",
  "calldata": "0xa9059cbb00000000000000000000000022222222222222222222222222222222222222220000000000000000000000000000000000000000000000000000000005f5e100",
  "language": "bilingual",
  "tokenDecimals": {
    "USDC": 6,
    "0xc879c018db60520f4355c26ed1a6d572cdac1815": 6
  },
  "policy": {
    "allowedTargets": [
      "0xc879c018db60520f4355c26ed1a6d572cdac1815"
    ],
    "allowedRecipients": [
      "0x2222222222222222222222222222222222222222"
    ],
    "maxTokenAmounts": {
      "USDC": "50"
    }
  },
  "addressBook": {
    "USDC": "0xc879c018db60520f4355c26ed1a6d572cdac1815",
    "recipient": "0x2222222222222222222222222222222222222222"
  }
}
