{
  "user_intent": "Approve 10 USDC for the verified router on Pharos",
  "chainId": 1672,
  "from": "0x146b605c8b371d5b50c3ea560fd1a2081aee7557",
  "to": "0x000000000022d473030f116ddee9f6b43ac78ba3",
  "value": "0x0",
  "calldata": "0x87517c45000000000000000000000000c879c018db60520f4355c26ed1a6d572cdac18150000000000000000000000005555555555555555555555555555555555555555000000000000000000000000000000000000000000000000000000000000000a000000000000000000000000000000000000000000000000000000000000ffff",
  "trustedSpenders": [
    "0x5555555555555555555555555555555555555555"
  ],
  "tokenDecimals": {
    "USDC": 6,
    "0xc879c018db60520f4355c26ed1a6d572cdac1815": 6
  }
}
