{
  "user_intent": "Transfer 100 USDC to 0x2222222222222222222222222222222222222222",
  "chainId": 688689,
  "from": "0x146b605c8b371d5b50c3ea560fd1a2081aee7557",
  "to": "0xcfc8330f4bcab529c625d12781b1c19466a9fc8b",
  "value": "0x0",
  "calldata": "0xa9059cbb00000000000000000000000022222222222222222222222222222222222222220000000000000000000000000000000000000000000000000000000005f5e100",
  "tokenDecimals": {
    "USDC": 6,
    "0xcfc8330f4bcab529c625d12781b1c19466a9fc8b": 6
  },
  "addressBook": {
    "USDC": "0xcfc8330f4bcab529c625d12781b1c19466a9fc8b",
    "recipient": "0x2222222222222222222222222222222222222222"
  }
}
