{
  "user_intent": "Claim my rewards from 0x7777777777777777777777777777777777777777",
  "chainId": 688689,
  "from": "0x146b605c8b371d5b50c3ea560fd1a2081aee7557",
  "to": "0x7777777777777777777777777777777777777777",
  "value": "0x0",
  "calldata": "0xdeadbeef0000000000000000000000009999999999999999999999999999999999999999"
}
