{
  "user_intent": "Swap 10 USDC to PHRS on Pharos",
  "chainId": 688689,
  "from": "0x146b605c8b371d5b50c3ea560fd1a2081aee7557",
  "to": "0xcfc8330f4bcab529c625d12781b1c19466a9fc8b",
  "value": "0x0",
  "calldata": "0x095ea7b30000000000000000000000004444444444444444444444444444444444444444ffffffffffffffffffffffffffffffffffffffffffffffffffffffffffffffff",
  "trustedSpenders": [
    "0x5555555555555555555555555555555555555555"
  ],
  "tokenDecimals": {
    "USDC": 6,
    "0xcfc8330f4bcab529c625d12781b1c19466a9fc8b": 6
  },
  "addressBook": {
    "USDC": "0xcfc8330f4bcab529c625d12781b1c19466a9fc8b",
    "verifiedRouter": "0x5555555555555555555555555555555555555555"
  }
}
